<?xml version="1.0"?>
<!DOCTYPE HPCToolkitExperiment [
<!-- ******************************************************************** -->
<!-- HPCToolkit Experiment DTD						  -->
<!-- Version 2.0							  -->
<!-- ******************************************************************** -->
<!ELEMENT HPCToolkitExperiment (Header, (SecCallPathProfile|SecFlatProfile)*)>
<!ATTLIST HPCToolkitExperiment
	  version CDATA #REQUIRED>

  <!-- ****************************************************************** -->

  <!-- Info/NV: flexible name-value pairs: (n)ame; (t)ype; (v)alue -->
  <!ELEMENT Info (NV*)>
  <!ATTLIST Info
	    n CDATA #IMPLIED>
  <!ELEMENT NV EMPTY>
  <!ATTLIST NV
	    n CDATA #REQUIRED
	    t CDATA #IMPLIED
	    v CDATA #REQUIRED>

  <!-- ****************************************************************** -->
  <!-- Header								  -->
  <!-- ****************************************************************** -->
  <!ELEMENT Header (Info*)>
  <!ATTLIST Header
	    n CDATA #REQUIRED>

  <!-- ****************************************************************** -->
  <!-- Section Header							  -->
  <!-- ****************************************************************** -->
  <!ELEMENT SecHeader (MetricTable?, MetricDBTable?, TraceDBTable?, LoadModuleTable?, FileTable?, ProcedureTable?, Info*)>

    <!-- MetricTable: -->
    <!ELEMENT MetricTable (Metric)*>

    <!-- Metric: (i)d; (n)ame -->
    <!--   (v)alue-type: transient type of values -->
    <!--   (t)ype: persistent type of metric -->
    <!--   fmt: format; show; -->
    <!ELEMENT Metric (MetricFormula*, Info?)>
    <!ATTLIST Metric
	      i            CDATA #REQUIRED
	      n            CDATA #REQUIRED
	      v            (raw|final|derived-incr|derived) "raw"
	      t            (inclusive|exclusive|nil) "nil"
	      partner      CDATA #IMPLIED
	      fmt          CDATA #IMPLIED
	      show         (1|0) "1"
	      show-percent (1|0) "1">

    <!-- MetricFormula represents derived metrics: (t)ype; (frm): formula -->
    <!ELEMENT MetricFormula (Info?)>
    <!ATTLIST MetricFormula
	      t   (combine|finalize) "finalize"
	      i   CDATA #IMPLIED
	      frm CDATA #REQUIRED>

    <!-- Metric data, used in sections: (n)ame [from Metric]; (v)alue -->
    <!ELEMENT M EMPTY>
    <!ATTLIST M
	      n CDATA #REQUIRED
	      v CDATA #REQUIRED>

    <!-- MetricDBTable: -->
    <!ELEMENT MetricDBTable (MetricDB)*>

    <!-- MetricDB: (i)d; (n)ame -->
    <!--   db-glob:        file glob describing files in metric db -->
    <!--   db-id:          id within metric db -->
    <!--   db-num-metrics: number of metrics in db -->
    <!--   db-header-sz:   size (in bytes) of a db file header -->
    <!ELEMENT MetricDB EMPTY>
    <!ATTLIST MetricDB
	      i              CDATA #REQUIRED
	      n              CDATA #REQUIRED
	      db-glob        CDATA #IMPLIED
	      db-id          CDATA #IMPLIED
	      db-num-metrics CDATA #IMPLIED
	      db-header-sz   CDATA #IMPLIED>

    <!-- TraceDBTable: -->
    <!ELEMENT TraceDBTable (TraceDB)>

    <!-- TraceDB: (i)d -->
    <!--   db-min-time: min beginning time stamp (global) -->
    <!--   db-max-time: max ending time stamp (global) -->
    <!ELEMENT TraceDB EMPTY>
    <!ATTLIST TraceDB
	      i            CDATA #REQUIRED
	      db-glob      CDATA #IMPLIED
	      db-min-time  CDATA #IMPLIED
	      db-max-time  CDATA #IMPLIED
	      db-header-sz CDATA #IMPLIED>

    <!-- LoadModuleTable assigns a short name to a load module -->
    <!ELEMENT LoadModuleTable (LoadModule)*>

    <!ELEMENT LoadModule (Info?)>
    <!ATTLIST LoadModule
	      i CDATA #REQUIRED
	      n CDATA #REQUIRED>

    <!-- FileTable assigns a short name to a file -->
    <!ELEMENT FileTable (File)*>

    <!ELEMENT File (Info?)>
    <!ATTLIST File
	      i CDATA #REQUIRED
	      n CDATA #REQUIRED>

    <!-- ProcedureTable assigns a short name to a procedure -->
    <!ELEMENT ProcedureTable (Procedure)*>

    <!ELEMENT Procedure (Info?)>
    <!ATTLIST Procedure
	      i CDATA #REQUIRED
	      n CDATA #REQUIRED>

  <!-- ****************************************************************** -->
  <!-- Section: Call path profile					  -->
  <!-- ****************************************************************** -->
  <!ELEMENT SecCallPathProfile (SecHeader, SecCallPathProfileData)>
  <!ATTLIST SecCallPathProfile
	    i CDATA #REQUIRED
	    n CDATA #REQUIRED>

    <!ELEMENT SecCallPathProfileData (PF|M)*>
      <!-- Procedure frame -->
      <!--   (i)d: unique identifier for cross referencing -->
      <!--   (s)tatic scope id -->
      <!--   (n)ame: a string or an id in ProcedureTable -->
      <!--   (lm) load module: a string or an id in LoadModuleTable -->
      <!--   (f)ile name: a string or an id in LoadModuleTable -->
      <!--   (l)ine range: "beg-end" (inclusive range) -->
      <!--   (a)lien: whether frame is alien to enclosing P -->
      <!--   (v)ma-range-set: "{[beg-end), [beg-end)...}" -->
      <!ELEMENT PF (PF|Pr|L|C|S|M)*>
      <!ATTLIST PF
		i  CDATA #IMPLIED
		s  CDATA #IMPLIED
		n  CDATA #REQUIRED
		lm CDATA #IMPLIED
		f  CDATA #IMPLIED
		l  CDATA #IMPLIED
		v  CDATA #IMPLIED>
      <!-- Procedure (static): GOAL: replace with 'P' -->
      <!ELEMENT Pr (Pr|L|C|S|M)*>
      <!ATTLIST Pr
                i  CDATA #IMPLIED
		s  CDATA #IMPLIED
                n  CDATA #REQUIRED
		lm CDATA #IMPLIED
		f  CDATA #IMPLIED
                l  CDATA #IMPLIED
		a  (1|0) "0"
		v  CDATA #IMPLIED>
      <!-- Callsite (a special StatementRange) -->
      <!ELEMENT C (PF|M)*>
      <!ATTLIST C
		i CDATA #IMPLIED
		s CDATA #IMPLIED
		l CDATA #IMPLIED
		v CDATA #IMPLIED>

  <!-- ****************************************************************** -->
  <!-- Section: Flat profile						  -->
  <!-- ****************************************************************** -->
  <!ELEMENT SecFlatProfile (SecHeader, SecFlatProfileData)>
  <!ATTLIST SecFlatProfile
	    i CDATA #REQUIRED
	    n CDATA #REQUIRED>

    <!ELEMENT SecFlatProfileData (LM|M)*>
      <!-- Load module: (i)d; (n)ame; (v)ma-range-set -->
      <!ELEMENT LM (F|P|M)*>
      <!ATTLIST LM
                i CDATA #IMPLIED
                n CDATA #REQUIRED
		v CDATA #IMPLIED>
      <!-- File -->
      <!ELEMENT F (P|L|S|M)*>
      <!ATTLIST F
                i CDATA #IMPLIED
                n CDATA #REQUIRED>
      <!-- Procedure (Note 1) -->
      <!ELEMENT P (P|A|L|S|C|M)*>
      <!ATTLIST P
                i CDATA #IMPLIED
                n CDATA #REQUIRED
                l CDATA #IMPLIED
		v CDATA #IMPLIED>
      <!-- Alien (Note 1) -->
      <!ELEMENT A (A|L|S|C|M)*>
      <!ATTLIST A
                i CDATA #IMPLIED
                f CDATA #IMPLIED
                n CDATA #IMPLIED
                l CDATA #IMPLIED
		v CDATA #IMPLIED>
      <!-- Loop (Note 1,2) -->
      <!ELEMENT L (A|Pr|L|S|C|M)*>
      <!ATTLIST L
		i CDATA #IMPLIED
		s CDATA #IMPLIED
		l CDATA #IMPLIED
	        f CDATA #IMPLIED
		v CDATA #IMPLIED>
      <!-- Statement (Note 2) -->
      <!--   (it): trace record identifier -->
      <!ELEMENT S (S|M)*>
      <!ATTLIST S
		i  CDATA #IMPLIED
		it CDATA #IMPLIED
		s  CDATA #IMPLIED
		l  CDATA #IMPLIED
		v  CDATA #IMPLIED>
      <!-- Note 1: Contained Cs may not contain PFs -->
      <!-- Note 2: The 's' attribute is not used for flat profiles -->
]>
<HPCToolkitExperiment version="2.0">
<Header n="test3">
  <Info/>
</Header>
<SecCallPathProfile i="0" n="test3">
<SecHeader>
  <MetricTable>
    <Metric i="48" n="REALTIME (usec):Sum (I)" v="derived-incr" t="inclusive" partner="49" show="1" show-percent="1">
      <MetricFormula t="combine" frm="sum($48, $48)"/>
      <MetricFormula t="finalize" frm="$48"/>
      <Info><NV n="units" v="events"/></Info>
    </Metric>
    <Metric i="49" n="REALTIME (usec):Sum (E)" v="derived-incr" t="exclusive" partner="48" show="1" show-percent="1">
      <MetricFormula t="combine" frm="sum($49, $49)"/>
      <MetricFormula t="finalize" frm="$49"/>
      <Info><NV n="units" v="events"/></Info>
    </Metric>
  </MetricTable>
  <MetricDBTable>
  </MetricDBTable>
  <TraceDBTable>
    <TraceDB i="0" db-glob="*.hpctrace" db-min-time="1472350382864380" db-max-time="1472350512455028" db-header-sz="32"/>
  </TraceDBTable>
  <LoadModuleTable>
    <LoadModule i="2" n="/global/u2/h/hashim/GitLab/ALLVM/openMP_exp/build/test3"/>
  </LoadModuleTable>
  <FileTable>
    <File i="731" n="/global/common/edison/usg/hpctoolkit/build/hpctoolkit-externals/BUILD/libmonitor/work/src/../../libmonitor-0.x-r149/src/pthread.c"/>
    <File i="37022" n="./src/usr/include/unistd.h"/>
    <File i="37063" n="/usr/src/packages/BUILD/glibc-2.11.3/misc/../sysdeps/unix/sysv/linux/x86_64/syscall.S"/>
    <File i="57739" n="/usr/src/packages/BUILD/glibc-2.11.3/misc/../sysdeps/unix/sysv/linux/getsysstats.c"/>
    <File i="58701" n="/usr/src/packages/BUILD/glibc-2.11.3/nptl/../nptl/sysdeps/unix/sysv/linux/x86_64/lowlevellock.S"/>
    <File i="59080" n="/usr/src/packages/BUILD/glibc-2.11.3/nptl/../nptl/sysdeps/unix/sysv/linux/x86_64/pthread_cond_timedwait.S"/>
    <File i="59423" n="/usr/src/packages/BUILD/glibc-2.11.3/nptl/../nptl/sysdeps/unix/sysv/linux/x86_64/pthread_cond_wait.S"/>
    <File i="59687" n="/usr/src/packages/BUILD/glibc-2.11.3/nptl/../sysdeps/unix/syscall-template.S"/>
    <File i="61291" n="/usr/src/packages/BUILD/glibc-2.11.3/nptl/pthread_mutex_unlock.c"/>
    <File i="63058" n="/usr/src/packages/BUILD/glibc-2.11.3/posix/../sysdeps/unix/syscall-template.S"/>
    <File i="63171" n="/usr/src/packages/BUILD/glibc-2.11.3/posix/../sysdeps/unix/sysv/linux/x86_64/sysconf.c"/>
    <File i="63178" n="../sysdeps/unix/sysv/linux/x86_64/sysconf.c"/>
    <File i="63204" n="../sysdeps/unix/sysv/linux/x86_64/../sysconf.c"/>
    <File i="63206" n="/usr/src/packages/BUILD/glibc-2.11.3/posix/../sysdeps/posix/sysconf.c"/>
    <File i="70040" n="/usr/src/packages/BUILD/glibc-2.11.3/stdlib/rand.c"/>
    <File i="70059" n="/usr/src/packages/BUILD/glibc-2.11.3/stdlib/random.c"/>
    <File i="70116" n="/usr/src/packages/BUILD/glibc-2.11.3/stdlib/random_r.c"/>
    <File i="84031" n="frontend.o"/>
    <File i="84630" n="kmp_affinity.o"/>
    <File i="85267" n="kmp_barrier.o"/>
    <File i="85956" n="kmp_runtime.o"/>
    <File i="92562" n="z_Linux_util.o"/>
    <File i="92672" n="~unknown-file~"/>
    <File i="93008" n=""/>
    <File i="94703" n=""/>
    <File i="95944" n="z_Linux_asm.o"/>
    <File i="95986" n=""/>
    <File i="95987" n=""/>
    <File i="96024" n=""/>
    <File i="97264" n=""/>
    <File i="100067" n=""/>
    <File i="100110" n=""/>
  </FileTable>
  <ProcedureTable>
    <Procedure i="1303" n="__wrap_pthread_create"/>
    <Procedure i="37061" n="syscall"/>
    <Procedure i="37063" n="syscall"/>
    <Procedure i="57740" n="next_line"/>
    <Procedure i="57774" n="__get_nprocs"/>
    <Procedure i="58702" n="__lll_lock_wait_private"/>
    <Procedure i="58822" n="__lll_unlock_wake_private"/>
    <Procedure i="58833" n="__lll_unlock_wake"/>
    <Procedure i="59081" n="__pthread_cond_timedwait"/>
    <Procedure i="59424" n="pthread_cond_wait"/>
    <Procedure i="59731" n="__read_nocancel"/>
    <Procedure i="61372" n="_L_unlock_553"/>
    <Procedure i="63092" n="__sched_yield"/>
    <Procedure i="63172" n="__sysconf"/>
    <Procedure i="63178" n=""/>
    <Procedure i="63204" n="linux_sysconf"/>
    <Procedure i="63205" n=""/>
    <Procedure i="63206" n="posix_sysconf"/>
    <Procedure i="70041" n="rand"/>
    <Procedure i="70067" n="_L_lock_12"/>
    <Procedure i="70087" n="_L_unlock_23"/>
    <Procedure i="70109" n="__random"/>
    <Procedure i="70193" n="__random_r"/>
    <Procedure i="84055" n="rml::internal::internalPoolMalloc(rml::internal::MemoryPool*, unsigned long)"/>
    <Procedure i="84930" n="__kmp_affinity_create_x2apicid_map(AddrUnsPair**, kmp_i18n_id*)"/>
    <Procedure i="85056" n="__kmp_aux_affinity_initialize()"/>
    <Procedure i="85324" n="__kmp_hyper_barrier_gather(barrier_type, kmp_info*, int, int, void (*)(void*, void*), void*)"/>
    <Procedure i="85338" n="__kmp_hyper_barrier_release(barrier_type, kmp_info*, int, int, int, void*)"/>
    <Procedure i="86001" n="__kmp_do_serial_initialize()"/>
    <Procedure i="92572" n="__kmp_launch_monitor(void*)"/>
    <Procedure i="92630" n="__kmp_launch_worker(void*)"/>
    <Procedure i="92678" n="___kmp_allocate"/>
    <Procedure i="92842" n="__kmp_affinity_bind_thread"/>
    <Procedure i="92890" n="__kmp_affinity_initialize"/>
    <Procedure i="93007" n="__kmp_allocate_team"/>
    <Procedure i="93077" n="__kmp_allocate_thread"/>
    <Procedure i="93634" n="__kmp_create_worker"/>
    <Procedure i="94083" n="__kmp_external__ZN3rml8internal10MemoryPool13getEmptyBlockEm"/>
    <Procedure i="94661" n="__kmp_external__ZN3rml8internal7Backend15genericGetBlockEimb"/>
    <Procedure i="94701" n="__kmp_external__ZN3rml8internal7Backend17splitAlignedBlockEPNS0_9FreeBlockEimb"/>
    <Procedure i="95193" n="__kmp_external_scalable_aligned_malloc"/>
    <Procedure i="95299" n="__kmp_fork_barrier(int, int)"/>
    <Procedure i="95321" n="__kmp_fork_call"/>
    <Procedure i="95429" n="__kmp_get_global_thread_id_reg"/>
    <Procedure i="95608" n="__kmp_init_implicit_task"/>
    <Procedure i="95940" n="__kmp_invoke_microtask"/>
    <Procedure i="95944" n="L_kmp_invoke_pass_parms"/>
    <Procedure i="95948" n="__kmp_invoke_task_func"/>
    <Procedure i="95983" n="__kmp_join_barrier(int)"/>
    <Procedure i="96009" n="__kmp_join_call"/>
    <Procedure i="96023" n="__kmp_launch_thread"/>
    <Procedure i="96183" n="__kmp_parallel_initialize"/>
    <Procedure i="97000" n="__kmp_runtime_initialize"/>
    <Procedure i="97262" n="__kmp_suspend_64"/>
    <Procedure i="97526" n="__kmp_yield"/>
    <Procedure i="99583" n="__kmpc_fork_call"/>
    <Procedure i="100063" n="main"/>
    <Procedure i="100100" n="parallel_func()"/>
  </ProcedureTable>
  <Info/>
</SecHeader>
<SecCallPathProfileData>
<M n="48" v="3.08967e+09"/>
<PF i="2" s="92572" l="0" lm="2" f="92562" n="92572">
<M n="48" v="1.28664e+08"/>
<L i="3" s="92584" l="0" f="92562">
<M n="48" v="1.28664e+08"/>
<C i="4" s="92588" l="0">
<M n="48" v="1.28663e+08"/>
<PF i="5" s="59081" l="53" lm="2" f="59080" n="59081">
<M n="48" v="1.28663e+08"/><M n="49" v="1.28663e+08"/>
<S i="6" s="59082" l="53" it="265"/>
<L i="7" s="59117" l="273" f="59080">
<M n="48" v="1.28663e+08"/><M n="49" v="1.28663e+08"/>
<S i="8" s="59160" l="234">
<M n="48" v="1.28663e+08"/><M n="49" v="1.28663e+08"/>
</S>
</L>
</PF>
</C>
<C i="9" s="92592" l="0">
<M n="48" v="1003"/>
<PF i="10" s="61372" l="290" lm="2" f="61291" n="61372">
<M n="48" v="1003"/>
<C i="11" s="61374" l="290">
<M n="48" v="1003"/>
<PF i="12" s="58833" l="353" lm="2" f="58701" n="58833">
<M n="48" v="1003"/><M n="49" v="1003"/>
<S i="13" s="58834" l="353" it="4899"/>
</PF>
</C>
</PF>
</C>
</L>
</PF>
<PF i="14" s="92630" l="0" lm="2" f="92562" n="92630">
<M n="48" v="2.83228e+09"/>
<C i="15" s="92645" l="0">
<M n="48" v="2.83228e+09"/>
<PF i="16" s="96023" l="0" lm="2" f="92672" n="96023">
<M n="48" v="2.83228e+09"/><M n="49" v="1002"/>
<L i="17" s="96024" l="0" f="96024">
<M n="48" v="2.83228e+09"/><M n="49" v="1002"/>
<S i="18" s="96025" l="0" it="3657">
<M n="48" v="1002"/><M n="49" v="1002"/>
</S>
<C i="19" s="96026" l="0">
<M n="48" v="1.58673e+08"/>
<PF i="20" s="95299" l="0" lm="2" f="92672" n="95299">
<M n="48" v="1.58673e+08"/>
<C i="21" s="95315" l="0">
<M n="48" v="1.58673e+08"/>
<PF i="22" s="85338" l="0" lm="2" f="85267" n="85338">
<M n="48" v="1.58673e+08"/><M n="49" v="1.48255e+08"/>
<L i="23" s="85339" l="0" f="85267">
<M n="48" v="1.58672e+08"/><M n="49" v="5.884e+06"/>
<C i="24" s="85340" l="0">
<M n="48" v="2.95152e+06"/>
<PF i="25" s="97526" l="0" lm="2" f="92672" n="97526">
<M n="48" v="2.95152e+06"/><M n="49" v="2.95152e+06"/>
<S i="26" s="97527" l="0" it="2319">
<M n="48" v="2.95152e+06"/><M n="49" v="2.95152e+06"/>
</S>
</PF>
</C>
<S i="27" s="85340" l="0">
<M n="48" v="5.884e+06"/><M n="49" v="5.884e+06"/>
</S>
<C i="28" s="85341" l="0">
<M n="48" v="5.48763e+06"/>
<PF i="29" s="63092" l="82" lm="2" f="63058" n="63092">
<M n="48" v="5.38951e+06"/><M n="49" v="5.38951e+06"/>
<S i="30" s="63094" l="82" it="2307">
<M n="48" v="5.3785e+06"/><M n="49" v="5.3785e+06"/>
</S>
</PF>
<PF i="31" s="97526" l="0" lm="2" f="92672" n="97526">
<M n="48" v="98119"/><M n="49" v="98119"/>
<S i="32" s="97527" l="0" it="4793">
<M n="48" v="98119"/><M n="49" v="98119"/>
</S>
</PF>
</C>
<C i="33" s="85342" l="0">
<M n="48" v="1.97868e+06"/>
<PF i="34" s="97262" l="0" lm="2" f="92672" n="97262">
<M n="48" v="1.97868e+06"/>
<L i="35" s="97264" l="0" f="97264">
<M n="48" v="1.97868e+06"/>
<C i="36" s="97266" l="0">
<M n="48" v="1.97868e+06"/>
<PF i="37" s="59424" l="50" lm="2" f="59423" n="59424">
<M n="48" v="1.97868e+06"/><M n="49" v="1.97868e+06"/>
<S i="38" s="59425" l="50" it="3773"/>
<L i="39" s="59477" l="274" f="59423">
<M n="48" v="1.97868e+06"/><M n="49" v="1.97868e+06"/>
<S i="40" s="59505" l="181">
<M n="48" v="1.97767e+06"/><M n="49" v="1.97767e+06"/>
</S>
</L>
</PF>
</C>
</L>
</PF>
</C>
<L i="41" s="85343" l="0" f="85267">
<M n="48" v="1.42371e+08"/>
<L i="42" s="85344" l="0" f="85267">
<M n="48" v="1.42371e+08"/><M n="49" v="1.42371e+08"/>
<S i="43" s="85345" l="0" it="2227">
<M n="48" v="1.42371e+08"/><M n="49" v="1.42371e+08"/>
</S>
</L>
</L>
</L>
<C i="44" s="85351" l="0">
<M n="48" v="1002"/>
<PF i="45" s="95608" l="0" lm="2" f="92672" n="95608">
<M n="48" v="1002"/><M n="49" v="1002"/>
<S i="46" s="95609" l="0" it="2917">
<M n="48" v="1002"/><M n="49" v="1002"/>
</S>
</PF>
</C>
</PF>
</C>
</PF>
</C>
<C i="47" s="96030" l="0">
<M n="48" v="2.64737e+09"/>
<PF i="48" s="95948" l="0" lm="2" f="92672" n="95948">
<M n="48" v="2.64737e+09"/><M n="49" v="2004"/>
<S i="49" s="95949" l="0" it="5187">
<M n="48" v="2004"/><M n="49" v="2004"/>
</S>
<C i="50" s="95951" l="0">
<M n="48" v="2.64736e+09"/>
<PF i="51" s="95940" l="0" lm="2" f="92672" n="95940">
<M n="48" v="2.64736e+09"/>
<Pr i="52" s="95944" l="0" lm="2" f="95944" n="95944" a="1">
<M n="48" v="2.64736e+09"/>
<C i="53" s="95946" l="0">
<M n="48" v="2.64736e+09"/>
<PF i="54" s="100100" l="0" lm="2" f="92672" n="100100">
<M n="48" v="2.64736e+09"/><M n="49" v="1.77281e+06"/>
<L i="55" s="100110" l="0" f="100110">
<M n="48" v="2.64736e+09"/><M n="49" v="1.77281e+06"/>
<S i="56" s="100111" l="0" it="1375">
<M n="48" v="1.77281e+06"/><M n="49" v="1.77281e+06"/>
</S>
<C i="57" s="100112" l="0">
<M n="48" v="2.64559e+09"/>
<PF i="58" s="70041" l="27" lm="2" f="70040" n="70041">
<M n="48" v="2.64559e+09"/><M n="49" v="454714"/>
<S i="59" s="70043" l="27" it="3161">
<M n="48" v="313488"/><M n="49" v="313488"/>
</S>
<C i="60" s="70044" l="28">
<M n="48" v="2.64514e+09"/>
<PF i="61" s="70067" l="215" lm="2" f="70059" n="70067">
<M n="48" v="1.15047e+09"/><M n="49" v="313494"/>
<S i="62" s="70068" l="215" it="3697">
<M n="48" v="313494"/><M n="49" v="313494"/>
</S>
<C i="63" s="70069" l="215">
<M n="48" v="1.15016e+09"/>
<PF i="64" s="58702" l="81" lm="2" f="58701" n="58702">
<M n="48" v="1.15016e+09"/><M n="49" v="1.15016e+09"/>
<S i="65" s="58703" l="81" it="1193">
<M n="48" v="76114"/><M n="49" v="76114"/>
</S>
<S i="66" s="58704" l="83">
<M n="48" v="93144"/><M n="49" v="93144"/>
</S>
<L i="67" s="58710" l="95" f="58701">
<M n="48" v="1.1499e+09"/><M n="49" v="1.1499e+09"/>
<S i="68" s="58711" l="94">
<M n="48" v="105159"/><M n="49" v="105159"/>
</S>
<S i="69" s="58712" l="95">
<M n="48" v="336476"/><M n="49" v="336476"/>
</S>
<S i="70" s="58713" l="97">
<M n="48" v="1.14272e+09"/><M n="49" v="1.14272e+09"/>
</S>
<S i="71" s="58714" l="98">
<M n="48" v="41065"/><M n="49" v="41065"/>
</S>
<S i="72" s="58715" l="100">
<M n="48" v="6.69178e+06"/><M n="49" v="6.69178e+06"/>
</S>
</L>
</PF>
</C>
</PF>
<PF i="73" s="70087" l="215" lm="2" f="70059" n="70087">
<M n="48" v="1.43195e+09"/><M n="49" v="294455"/>
<S i="74" s="70088" l="215" it="3311">
<M n="48" v="294455"/><M n="49" v="294455"/>
</S>
<C i="75" s="70089" l="215">
<M n="48" v="1.43166e+09"/>
<PF i="76" s="58822" l="323" lm="2" f="58701" n="58822">
<M n="48" v="1.43166e+09"/><M n="49" v="1.43166e+09"/>
<S i="77" s="58823" l="323" it="1185">
<M n="48" v="106170"/><M n="49" v="106170"/>
</S>
<S i="78" s="58824" l="325">
<M n="48" v="165252"/><M n="49" v="165252"/>
</S>
<S i="79" s="58830" l="336">
<M n="48" v="1.43123e+09"/><M n="49" v="1.43123e+09"/>
</S>
<S i="80" s="58831" l="339">
<M n="48" v="73111"/><M n="49" v="73111"/>
</S>
</PF>
</C>
</PF>
<PF i="81" s="70109" l="293" lm="2" f="70059" n="70109">
<M n="48" v="6.27167e+07"/><M n="49" v="4.80735e+07"/>
<S i="82" s="70110" l="293" it="1201">
<M n="48" v="378578"/><M n="49" v="378578"/>
</S>
<S i="83" s="70111" l="296">
<M n="48" v="1.96623e+07"/><M n="49" v="1.96623e+07"/>
</S>
<S i="84" s="70112" l="298">
<M n="48" v="348529"/><M n="49" v="348529"/>
</S>
<C i="85" s="70113" l="298">
<M n="48" v="1.46432e+07"/>
<PF i="86" s="70193" l="364" lm="2" f="70116" n="70193">
<M n="48" v="1.46432e+07"/><M n="49" v="1.46432e+07"/>
<S i="87" s="70194" l="367" it="1405">
<M n="48" v="372562"/><M n="49" v="372562"/>
</S>
<S i="88" s="70195" l="370">
<M n="48" v="3.48982e+06"/><M n="49" v="3.48982e+06"/>
</S>
<S i="89" s="70196" l="372">
<M n="48" v="51081"/><M n="49" v="51081"/>
</S>
<S i="90" s="70200" l="381">
<M n="48" v="284443"/><M n="49" v="284443"/>
</S>
<S i="91" s="70201" l="382">
<M n="48" v="74135"/><M n="49" v="74135"/>
</S>
<S i="92" s="70203" l="386">
<M n="48" v="9.22242e+06"/><M n="49" v="9.22242e+06"/>
</S>
<S i="93" s="70205" l="389">
<M n="48" v="47078"/><M n="49" v="47078"/>
</S>
<S i="94" s="70206" l="390">
<M n="48" v="362560"/><M n="49" v="362560"/>
</S>
<S i="95" s="70209" l="398">
<M n="48" v="53077"/><M n="49" v="53077"/>
</S>
<S i="96" s="70210" l="401">
<M n="48" v="297453"/><M n="49" v="297453"/>
</S>
<S i="97" s="70211" l="402">
<M n="48" v="355553"/><M n="49" v="355553"/>
</S>
</PF>
</C>
<S i="98" s="70114" l="300">
<M n="48" v="2.72144e+07"/><M n="49" v="2.72144e+07"/>
</S>
<S i="99" s="70115" l="303">
<M n="48" v="469721"/><M n="49" v="469721"/>
</S>
</PF>
</C>
<S i="100" s="70045" l="29">
<M n="48" v="141226"/><M n="49" v="141226"/>
</S>
</PF>
</C>
</L>
</PF>
</C>
</Pr>
</PF>
</C>
</PF>
</C>
<C i="101" s="96032" l="0">
<M n="48" v="2.62435e+07"/>
<PF i="102" s="95983" l="0" lm="2" f="92672" n="95983">
<M n="48" v="2.62435e+07"/><M n="49" v="2003"/>
<L i="103" s="95986" l="0" f="95986">
<M n="48" v="2003"/>
<L i="104" s="95987" l="0" f="95987">
<M n="48" v="2003"/><M n="49" v="2003"/>
<S i="105" s="95988" l="0" it="5375">
<M n="48" v="2003"/><M n="49" v="2003"/>
</S>
</L>
</L>
<C i="106" s="96006" l="0">
<M n="48" v="2.62415e+07"/>
<PF i="107" s="85324" l="0" lm="2" f="85267" n="85324">
<M n="48" v="2.62415e+07"/><M n="49" v="2.39407e+07"/>
<L i="108" s="85325" l="0" f="85267">
<M n="48" v="2.62415e+07"/>
<L i="109" s="85326" l="0" f="85267">
<M n="48" v="2.62415e+07"/>
<L i="110" s="85327" l="0" f="85267">
<M n="48" v="2.62415e+07"/><M n="49" v="2.39407e+07"/>
<S i="111" s="85328" l="0" it="1943">
<M n="48" v="2.39407e+07"/><M n="49" v="2.39407e+07"/>
</S>
<C i="112" s="85329" l="0">
<M n="48" v="483569"/>
<PF i="113" s="97526" l="0" lm="2" f="92672" n="97526">
<M n="48" v="483569"/><M n="49" v="483569"/>
<S i="114" s="97527" l="0" it="2295">
<M n="48" v="483569"/><M n="49" v="483569"/>
</S>
</PF>
</C>
<C i="115" s="85330" l="0">
<M n="48" v="1.00848e+06"/>
<PF i="116" s="63092" l="82" lm="2" f="63058" n="63092">
<M n="48" v="993463"/><M n="49" v="993463"/>
<S i="117" s="63094" l="82" it="1977">
<M n="48" v="990460"/><M n="49" v="990460"/>
</S>
</PF>
<PF i="118" s="97526" l="0" lm="2" f="92672" n="97526">
<M n="48" v="15016"/><M n="49" v="15016"/>
<S i="119" s="97527" l="0" it="4253">
<M n="48" v="15016"/><M n="49" v="15016"/>
</S>
</PF>
</C>
<C i="120" s="85331" l="0">
<M n="48" v="808737"/>
<PF i="121" s="97262" l="0" lm="2" f="92672" n="97262">
<M n="48" v="808737"/>
<L i="122" s="97264" l="0" f="97264">
<M n="48" v="808737"/>
<C i="123" s="97266" l="0">
<M n="48" v="808737"/>
<PF i="124" s="59424" l="50" lm="2" f="59423" n="59424">
<M n="48" v="808737"/><M n="49" v="808737"/>
<S i="125" s="59425" l="50" it="1365"/>
<L i="126" s="59477" l="274" f="59423">
<M n="48" v="808737"/><M n="49" v="808737"/>
<S i="127" s="59505" l="181">
<M n="48" v="808737"/><M n="49" v="808737"/>
</S>
</L>
</PF>
</C>
</L>
</PF>
</C>
</L>
</L>
</L>
</PF>
</C>
</PF>
</C>
</L>
</PF>
</C>
</PF>
<PF i="128" s="100063" l="0" lm="2" f="92672" n="100063">
<M n="48" v="1.28722e+08"/>
<L i="129" s="100067" l="0" f="100067">
<M n="48" v="1.28722e+08"/>
<C i="130" s="100069" l="0">
<M n="48" v="1.28722e+08"/>
<PF i="131" s="100100" l="0" lm="2" f="92672" n="100100">
<M n="48" v="1.28722e+08"/>
<C i="132" s="100103" l="0">
<M n="48" v="3943"/>
<PF i="133" s="95429" l="0" lm="2" f="92672" n="95429">
<M n="48" v="3943"/>
<C i="134" s="95440" l="0">
<M n="48" v="3943"/>
<PF i="135" s="86001" l="0" lm="2" f="85956" n="86001">
<M n="48" v="3943"/>
<C i="136" s="86047" l="0">
<M n="48" v="3943"/>
<PF i="137" s="97000" l="0" lm="2" f="92672" n="97000">
<M n="48" v="3943"/>
<C i="138" s="97003" l="0">
<M n="48" v="3943"/>
<PF i="139" s="63172" l="33" lm="2" f="63171" n="63172">
<M n="48" v="3943"/>
<Pr i="140" s="63178" l="37" lm="2" f="63178" n="63178" a="1">
<M n="48" v="3943"/>
<Pr i="141" s="63204" l="136" lm="2" f="63204" n="63204" a="1">
<M n="48" v="3943"/>
<Pr i="142" s="63205" l="136" lm="2" f="63204" n="63205" a="1">
<M n="48" v="3943"/>
<Pr i="143" s="63206" l="54" lm="2" f="63206" n="63206" a="1">
<M n="48" v="3943"/>
<C i="144" s="63222" l="631">
<M n="48" v="3943"/>
<PF i="145" s="57774" l="130" lm="2" f="57739" n="57774">
<M n="48" v="3943"/>
<L i="146" s="57787" l="158" f="57739">
<M n="48" v="3943"/>
<C i="147" s="57789" l="152">
<M n="48" v="3943"/>
<PF i="148" s="57740" l="78" lm="2" f="57739" n="57740">
<M n="48" v="3943"/>
<C i="149" s="57753" l="91">
<M n="48" v="3943"/>
<PF i="150" s="59731" l="82" lm="2" f="59687" n="59731">
<M n="48" v="3943"/><M n="49" v="3943"/>
<S i="151" s="59733" l="82" it="39">
<M n="48" v="3943"/><M n="49" v="3943"/>
</S>
</PF>
</C>
</PF>
</C>
</L>
</PF>
</C>
</Pr>
</Pr>
</Pr>
</Pr>
</PF>
</C>
</PF>
</C>
</PF>
</C>
</PF>
</C>
<C i="152" s="100105" l="0">
<M n="48" v="1.28719e+08"/>
<PF i="153" s="99583" l="0" lm="2" f="92672" n="99583">
<M n="48" v="1.28719e+08"/>
<C i="154" s="99586" l="0">
<M n="48" v="1.14657e+08"/>
<PF i="155" s="95321" l="0" lm="2" f="92672" n="95321">
<M n="48" v="1.14657e+08"/>
<C i="156" s="95358" l="0">
<M n="48" v="1.14654e+08"/>
<PF i="157" s="95948" l="0" lm="2" f="92672" n="95948">
<M n="48" v="1.14654e+08"/>
<C i="158" s="95951" l="0">
<M n="48" v="1.14654e+08"/>
<PF i="159" s="95940" l="0" lm="2" f="92672" n="95940">
<M n="48" v="1.14654e+08"/>
<Pr i="160" s="95944" l="0" lm="2" f="95944" n="95944" a="1">
<M n="48" v="1.14654e+08"/>
<C i="161" s="95946" l="0">
<M n="48" v="1.14654e+08"/>
<PF i="162" s="100100" l="0" lm="2" f="92672" n="100100">
<M n="48" v="1.14654e+08"/><M n="49" v="79131"/>
<L i="163" s="100110" l="0" f="100110">
<M n="48" v="1.14654e+08"/><M n="49" v="79131"/>
<S i="164" s="100111" l="0" it="239">
<M n="48" v="79131"/><M n="49" v="79131"/>
</S>
<C i="165" s="100112" l="0">
<M n="48" v="1.14575e+08"/>
<PF i="166" s="70041" l="27" lm="2" f="70040" n="70041">
<M n="48" v="1.14575e+08"/><M n="49" v="25034"/>
<S i="167" s="70043" l="27" it="3155">
<M n="48" v="19024"/><M n="49" v="19024"/>
</S>
<C i="168" s="70044" l="28">
<M n="48" v="1.1455e+08"/>
<PF i="169" s="70067" l="215" lm="2" f="70059" n="70067">
<M n="48" v="4.92412e+07"/><M n="49" v="12019"/>
<S i="170" s="70068" l="215" it="4369">
<M n="48" v="12019"/><M n="49" v="12019"/>
</S>
<C i="171" s="70069" l="215">
<M n="48" v="4.92292e+07"/>
<PF i="172" s="58702" l="81" lm="2" f="58701" n="58702">
<M n="48" v="4.92292e+07"/><M n="49" v="4.92292e+07"/>
<S i="173" s="58703" l="81" it="2543">
<M n="48" v="1001"/><M n="49" v="1001"/>
</S>
<L i="174" s="58710" l="95" f="58701">
<M n="48" v="4.92232e+07"/><M n="49" v="4.92232e+07"/>
<S i="175" s="58713" l="97">
<M n="48" v="4.90069e+07"/><M n="49" v="4.90069e+07"/>
</S>
<S i="176" s="58715" l="100">
<M n="48" v="206335"/><M n="49" v="206335"/>
</S>
</L>
</PF>
</C>
</PF>
<PF i="177" s="70087" l="215" lm="2" f="70059" n="70087">
<M n="48" v="6.27559e+07"/><M n="49" v="16026"/>
<S i="178" s="70088" l="215" it="3999">
<M n="48" v="16026"/><M n="49" v="16026"/>
</S>
<C i="179" s="70089" l="215">
<M n="48" v="6.27399e+07"/>
<PF i="180" s="58822" l="323" lm="2" f="58701" n="58822">
<M n="48" v="6.27399e+07"/><M n="49" v="6.27399e+07"/>
<S i="181" s="58823" l="323" it="2537">
<M n="48" v="1001"/><M n="49" v="1001"/>
</S>
<S i="182" s="58830" l="336">
<M n="48" v="6.27328e+07"/><M n="49" v="6.27328e+07"/>
</S>
</PF>
</C>
</PF>
<PF i="183" s="70109" l="293" lm="2" f="70059" n="70109">
<M n="48" v="2.55296e+06"/><M n="49" v="1.98408e+06"/>
<S i="184" s="70110" l="293" it="247">
<M n="48" v="19029"/><M n="49" v="19029"/>
</S>
<S i="185" s="70111" l="296">
<M n="48" v="796232"/><M n="49" v="796232"/>
</S>
<C i="186" s="70113" l="298">
<M n="48" v="568882"/>
<PF i="187" s="70193" l="364" lm="2" f="70116" n="70193">
<M n="48" v="568882"/><M n="49" v="568882"/>
<S i="188" s="70194" l="367" it="253">
<M n="48" v="16017"/><M n="49" v="16017"/>
</S>
<S i="189" s="70195" l="370">
<M n="48" v="103163"/><M n="49" v="103163"/>
</S>
<S i="190" s="70203" l="386">
<M n="48" v="381590"/><M n="49" v="381590"/>
</S>
</PF>
</C>
<S i="191" s="70114" l="300">
<M n="48" v="1.13778e+06"/><M n="49" v="1.13778e+06"/>
</S>
</PF>
</C>
</PF>
</C>
</L>
</PF>
</C>
</Pr>
</PF>
</C>
</PF>
</C>
<C i="192" s="95367" l="0">
<M n="48" v="1007"/>
<PF i="193" s="93007" l="0" lm="2" f="92672" n="93007">
<M n="48" v="1007"/>
<L i="194" s="93008" l="0" f="93008">
<M n="48" v="1007"/>
<C i="195" s="93019" l="0">
<M n="48" v="1007"/>
<PF i="196" s="93077" l="0" lm="2" f="92672" n="93077">